{
  "schemaVersion": 1,
  "tool": "matlatl",
  "generatedNote": "Generated by matlatl. Suggested reading orders (associative trails, Bush 1945): each trail is a topologically-valid order for one connected cluster, rooted at its most important (highest-PageRank) document and preferring higher-authority docs among the available frontier.",
  "trails": [
    {
      "root": "CHANGELOG.md",
      "order": [
        "CHANGELOG.md"
      ]
    },
    {
      "root": "docs/cycle/alpha.md",
      "order": [
        "docs/cycle/alpha.md",
        "docs/cycle/beta.md"
      ]
    },
    {
      "root": "docs/guide.md",
      "order": [
        "docs/README.md",
        "docs/flow/aside.md",
        "docs/links.md",
        "docs/stray.md",
        "docs/guide.md",
        "docs/sub/overview.md",
        "README.md",
        "docs/flow/branch.md",
        "docs/flow/terminal.md"
      ]
    },
    {
      "root": "docs/island/one.md",
      "order": [
        "docs/island/four.md",
        "docs/island/three.md",
        "docs/island/one.md",
        "docs/island/two.md"
      ]
    },
    {
      "root": "docs/project/notes.md",
      "order": [
        "docs/project/notes.md"
      ]
    },
    {
      "root": "docs/team/notes.md",
      "order": [
        "docs/team/notes.md"
      ]
    }
  ]
}
